{
  "schema": "ihat://identity/service-account/v1",
  "id": "service-account/nerp-001",
  "revision": 1,
  "created_at": "2026-08-03T01:00:00.000Z",
  "updated_at": "2026-08-03T01:00:20.000Z",
  "digest": "sha256:620c273a269017b8d86f6981ee1e557003fbb0f11d80a8d369b6aaeaba2f93dd",
  "service_id": "nerp",
  "pairwise_subject": "pairwise_nerp_subject_001",
  "roles": ["member"],
  "status": "active",
  "opened_at": "2026-08-03T01:00:05.000Z",
  "revocation_epoch": 0
}
